category,text
politica,esteban torres aportaré en la gobernabilidad en dar un sentido a la lógica del presidente de una gestión de consenso sin extremos y sin antis.
politica,el exlegislador del psc se sumó al gabinete y apoyará en el frente político. dice ser conciliador sin líneas rojas y con un estilo parecido al de daniel noboa..
politica,jorge glas se suma a la lista de correístas prófugos o no que han pedido protección al gobierno mexicano.
politica,méxico permitió ingreso de jorge glas a embajada en quito como huésped aún no se formaliza pedido de asilo político.
politica,cancillería de ecuador espera que ese país invite al exvicepresidente a cooperar con las autoridades policiales..
politica,cancillería ecuatoriana confirma que jorge glas permanece en la embajada de méxico y pide colaboración.
politica,el ministerio de relaciones exteriores pidió información sobre las razones por las que jorge glas permanece en la sede de diplomática mexicana..
politica,dirección general del consejo de la judicatura suspende logística del concurso para selección de jueces de la corte.
politica,fiscalía pide localizar y detener a jorge glas para investigaciones por presunto delito de peculado.
politica,lucio gutiérrez planteará al pleno de la asamblea nacional el archivo del juicio político a la fiscal diana salazar.
politica,asamblea nacional debatirá el martes proyecto de ley urgente de eficiencia económica y generación de empleo.
politica,asamblea nacional cumple un mes en funciones con cinco leyes aprobadas y el acuerdo de gobernabilidad vigente.
politica,fiscalía general del estado llama a la ciudadanía a estar alerta a cualquier intento de evitar la decisión del juez en el caso metástasis.
politica,asamblea nacional es convocada para ratificar la prelación de juicios políticos contra esteban bernal y miembros del consejo de la judicatura.
politica,presidente daniel noboa espera una ágil aprobación de la ley económica en la asamblea nacional.
politica,daniel noboa no olvidar la semana en que se atacó a la delincuencia al crimen organizado y a la corrupción enquistada en la función judicial.
politica,consulta popular de daniel noboa sería entre la última semana de febrero y la primera de marzo.
politica,ley urgente incluirá beneficios fiscales a quienes donen equipamiento y suministros a la policía nacional en materia de seguridad.
politica,consejo de participación ciudadana cuenta con el reglamento para elegir a vocales faltantes del consejo de la judicatura.
politica,ley de salud mental logra aprobación unánime de la asamblea nacional.
politica,trámite legislativo sobre ley urgente entra a definición de textos en la comisión de desarrollo económico.
politica,la crisis política está siendo capitalizada por el sector extractivo.
politica,el presidente guillermo lasso decreta la disolución de la asamblea nacional de ecuador y solicita la convocatoria de elecciones.
politica,la política como disciplina social busca establecer normas y estructuras que regulen la convivencia de individuos en una sociedad fomentando la cohesión y el bienestar común..
politica,en el contexto democrático la participación ciudadana se erige como pilar fundamental permitiendo a los ciudadanos expresar sus preferencias y contribuir activamente al proceso de toma de decisiones políticas..
politica,la división de poderes concebida por montesquieu constituye un principio esencial en la construcción de sistemas políticos que buscan evitar la concentración excesiva de autoridad y salvaguardar los derechos individuales..
politica,los partidos políticos al ser vehículos de expresión ideológica y portadores de propuestas políticas desempeñan un papel vital en la articulación y canalización de las demandas y preferencias de la sociedad..
politica,los sistemas electorales desempeñan un papel crucial en la configuración de los gobiernos definiendo la representación política y la distribución de poder en función de la voluntad popular expresada en las urnas..
politica,la globalización ha transformado la naturaleza de la política generando desafíos y oportunidades que requieren respuestas coordinadas a nivel internacional para abordar problemas como el cambio climático la pobreza y los conflictos transnacionales..
politica,las políticas públicas al ser el conjunto de acciones y decisiones gubernamentales buscan abordar problemas sociales económicos y ambientales orientando el desarrollo de la sociedad hacia metas de bienestar y equidad..
politica,la diplomacia como instrumento de la política exterior busca mantener relaciones pacíficas entre naciones y resolver disputas mediante el diálogo y la negociación evitando el recurso a la violencia como método de resolución de conflictos..
politica,la corrupción entendida como el abuso de poder para beneficio personal representa una amenaza constante para la estabilidad política y económica debilitando las instituciones y erosionando la confianza ciudadana en el sistema..
politica,la gobernabilidad efectiva implica la capacidad del estado para implementar políticas de manera eficiente garantizando la estabilidad y el funcionamiento adecuado de las instituciones lo cual es esencial para el desarrollo sostenible..
politica,los derechos humanos como marco ético universal deben ser salvaguardados por los estados garantizando la dignidad y la igualdad de todos los individuos independientemente de su origen étnico religión o género..
politica,la justicia social como principio rector de la política busca reducir las disparidades económicas y garantizar el acceso equitativo a oportunidades promoviendo así una sociedad más inclusiva y cohesionada..
politica,la globalización económica plantea desafíos en términos de regulación y supervisión requiriendo una cooperación internacional efectiva para abordar cuestiones como el comercio justo y la evasión fiscal..
politica,el populismo como fenómeno político puede surgir como respuesta a la insatisfacción ciudadana pero también plantea riesgos al simplificar problemas complejos y erosionar las instituciones democráticas..
politica,la descentralización administrativa puede fortalecer la participación ciudadana y la eficiencia gubernamental al empoderar a las comunidades locales en la toma de decisiones que afectan directamente a sus habitantes..
politica,la educación cívica al promover el entendimiento de los procesos políticos y fomentar la participación informada contribuye al fortalecimiento de la democracia y la construcción de una ciudadanía activa..
politica,la gestión de crisis ya sea en situaciones de desastres naturales o conflictos pone a prueba la capacidad de los gobiernos para coordinar respuestas efectivas y salvaguardar la seguridad y el bienestar de la población..
politica,la geopolítica al analizar las relaciones entre estados y la distribución de poder a nivel mundial influye en la formulación de estrategias políticas y en la toma de decisiones que afectan la seguridad y la estabilidad internacional..
politica,la soberanía nacional en un mundo interconectado se enfrenta a desafíos que van más allá de las fronteras requiriendo un equilibrio entre la autonomía estatal y la cooperación internacional para abordar problemas transnacionales..
politica,el federalismo al distribuir el poder entre niveles de gobierno busca equilibrar la autonomía local con la coordinación nacional permitiendo adaptar políticas a las necesidades específicas de diferentes regiones..
politica,la construcción de políticas de inclusión social debe abordar no solo la igualdad de oportunidades sino también la eliminación de barreras y prejuicios que perpetúan la discriminación en ámbitos como la educación y el empleo..
politica,la libertad de prensa como pilar de la democracia debe ser protegida para garantizar el acceso a información veraz y plural empoderando a la ciudadanía y promoviendo la rendición de cuentas de los poderes públicos..
politica,la ciberseguridad en la era digital se ha convertido en un aspecto crucial de la política nacional e internacional con la protección de datos y la prevención de ciberataques siendo prioridades estratégicas..
politica,la economía política al analizar las interacciones entre el sistema económico y las instituciones políticas revela cómo las decisiones gubernamentales afectan la distribución de recursos y la equidad social..
politica,la política de migración al abordar cuestiones como la movilidad humana y la integración de migrantes requiere enfoques comprensivos que respeten los derechos humanos y promuevan la diversidad cultural..
politica,la política monetaria al ser una herramienta para gestionar la oferta de dinero y la estabilidad económica influye directamente en el crecimiento y la inflación impactando la calidad de vida de los ciudadanos..
politica,la justicia transicional como estrategia para abordar violaciones a los derechos humanos en el pasado busca equilibrar la reconciliación con la rendición de cuentas promoviendo la construcción de sociedades justas y pacíficas..
politica,la política medioambiental ante la urgencia de la crisis climática demanda acciones decididas para mitigar el cambio climático preservar la biodiversidad y promover un desarrollo sostenible que no comprometa el futuro del planeta..
politica,la cooperación internacional en el ámbito humanitario es esencial para abordar crisis globales como pandemias hambrunas y desplazamientos forzados.
politica,la política de salud pública en particular durante crisis sanitarias como la pandemia de covid 19 destaca la importancia de la planificación coordinación y toma de decisiones gubernamentales para proteger la salud de la población..
politica,el populismo autoritario caracterizado por líderes que buscan concentrar poder y socavar las instituciones democráticas plantea desafíos para la preservación de los valores democráticos y el respeto a los derechos individuales..
politica,la guerra comercial como fenómeno político y económico puede tener repercusiones significativas en las relaciones internacionales afectando el comercio la inversión y la estabilidad global.
politica,la política de desarrollo al abordar cuestiones como la reducción de la pobreza y la promoción del crecimiento económico sostenible busca mejorar las condiciones de vida de las poblaciones en países en desarrollo..
tecnologia,la revolución tecnológica ha transformado radicalmente la forma en que interactuamos con el mundo permeando cada aspecto de nuestra vida cotidiana..
tecnologia,la inteligencia artificial al combinar algoritmos avanzados y poder de cómputo ha logrado avances significativos en campos tan diversos como la medicina la educación y la industria..
tecnologia,la internet de las cosas iot al conectar dispositivos cotidianos a la red ha creado un entorno interconectado que promete eficiencia y comodidad pero también plantea desafíos en términos de privacidad y seguridad..
tecnologia,la ciberseguridad se erige como una preocupación primordial en la era digital donde la protección de datos y la prevención de amenazas informáticas son esenciales para garantizar la integridad de sistemas y redes..
tecnologia,la realidad virtual y la realidad aumentada están redefiniendo la experiencia humana al proporcionar entornos inmersivos que van más allá de las limitaciones físicas del mundo real..
tecnologia,la automatización impulsada por la robótica y la inteligencia artificial está transformando la naturaleza del trabajo planteando preguntas cruciales sobre la reinvención de las estructuras laborales y la capacitación profesional..
tecnologia,los avances en la computación cuántica al explorar la manipulación de qubits abren la puerta a una nueva era de procesamiento de información con el potencial de revolucionar la resolución de problemas complejos..
tecnologia,la realidad aumentada al superponer información digital en el mundo físico ofrece aplicaciones que van más allá del entretenimiento incluyendo la formación profesional y la asistencia en la toma de decisiones..
tecnologia,la biotecnología al combinar conocimientos de genética y tecnología ha permitido avances notables en la medicina desde terapias génicas hasta la creación de vacunas innovadoras..
tecnologia,la movilidad inteligente con el auge de los vehículos autónomos y la optimización de sistemas de transporte plantea la posibilidad de ciudades más eficientes y sostenibles..
tecnologia,la computación en la nube al permitir el acceso remoto a recursos informáticos ha transformado la manera en que almacenamos procesamos y compartimos datos a escala global..
tecnologia,la ética en la inteligencia artificial se ha convertido en un tema candente ya que el desarrollo de algoritmos y sistemas autónomos plantea preguntas fundamentales sobre la responsabilidad y el impacto social..
tecnologia,las tecnologías de energía renovable desde la solar hasta la eólica están desempeñando un papel crucial en la transición hacia un futuro más sostenible y libre de emisiones de carbono..
tecnologia,la realidad mixta combinando elementos de realidad virtual y realidad aumentada abre posibilidades creativas y prácticas que van más allá de las capacidades de cada tecnología por separado..
tecnologia,la medicina personalizada gracias a la información genómica y las tecnologías de diagnóstico avanzado permite tratamientos más específicos y efectivos adaptados a las características individuales de cada paciente..
tecnologia,la tecnología blockchain conocida por su aplicación en criptomonedas como el bitcoin también tiene el potencial de revolucionar la transparencia y la seguridad en sectores como la cadena de suministro y la gestión de datos..
tecnologia,la 5g la quinta generación de redes móviles está impulsando la conectividad ultrarrápida y la comunicación instantánea sentando las bases para la proliferación de tecnologías emergentes como el internet de las cosas..
tecnologia,la realidad híbrida al integrar elementos virtuales y físicos de manera fluida redefine la interacción humana con el entorno desde la educación hasta el entretenimiento..
tecnologia,la impresión 3d al permitir la fabricación de objetos tridimensionales a partir de modelos digitales está cambiando la forma en que concebimos la producción y distribución de bienes..
tecnologia,la neurotecnología explorando la interfaz entre la tecnología y el cerebro humano plantea posibilidades fascinantes pero también suscita preguntas éticas sobre la privacidad y la manipulación cognitiva..
tecnologia,la realidad sensorial extendida que busca expandir nuestras experiencias sensoriales más allá de los límites naturales abre la puerta a nuevas formas de comunicación y expresión artística..
tecnologia,la nanotecnología manipulando materiales a escala molecular tiene aplicaciones potenciales desde la medicina hasta la fabricación de dispositivos electrónicos más pequeños y eficientes..
tecnologia,la tecnología de reconocimiento facial aunque ofrece avances en seguridad y conveniencia plantea inquietudes sobre la privacidad y el uso ético de datos biométricos..
tecnologia,la realidad conectada integrando diversos dispositivos y servicios en una experiencia cohesiva redefine la forma en que vivimos trabajamos y nos relacionamos en un mundo cada vez más interconectado..
tecnologia,la computación afectiva al analizar las expresiones faciales y vocales busca dotar a las máquinas de la capacidad de comprender y responder a las emociones humanas mejorando la interacción hombre máquina..
tecnologia,la bioimpresión utilizando células vivas para fabricar tejidos y órganos representa un avance prometedor en el campo de la medicina regenerativa y la personalización de tratamientos médicos..
tecnologia,la realidad social extendida combinando elementos físicos y virtuales en espacios compartidos redefine la noción de comunidad y colaboración en un entorno digital..
tecnologia,la tecnología de reconocimiento de voz impulsada por la inteligencia artificial ha mejorado significativamente la interacción entre humanos y dispositivos facilitando la automatización y la accesibilidad..
tecnologia,la teledetección mediante el uso de satélites y sensores remotos facilita la monitorización y gestión de recursos naturales contribuyendo a la comprensión y mitigación de fenómenos ambientales..
tecnologia,la computación sin servidor al permitir la ejecución de código sin la necesidad de gestionar servidores simplifica la infraestructura de desarrollo y promueve la escalabilidad en entornos tecnológicos..
tecnologia,la computación perimetral descentralizando el procesamiento de datos hacia los límites de la red optimiza la velocidad y eficiencia en la transmisión de información en entornos de alta conectividad..
tecnologia,la ingeniería genética al modificar el código genético de organismos tiene aplicaciones potenciales que van desde la creación de cultivos resistentes hasta la terapia génica para enfermedades genéticas..
tecnologia,la tecnología 6g aún en etapas de investigación anticipa una nueva generación de redes móviles que promete velocidades ultra rápidas y capacidades de comunicación avanzadas..
tecnologia,la computación cognitiva inspirada en el funcionamiento del cerebro humano busca desarrollar sistemas capaces de aprender razonar y procesar información de manera similar a la mente humana..
tecnologia,la tecnología de captura de carbono crucial en la lucha contra el cambio climático busca reducir las emisiones de gases de efecto invernadero capturándolos directamente de fuentes industriales..
tecnologia,la informática cuántica al aprovechar las propiedades cuánticas de las partículas busca superar las limitaciones de la computación clásica en la resolución de problemas complejos..
tecnologia,la computación distribuida al descentralizar el procesamiento de datos en una red mejora la redundancia y la resistencia frente a fallos fundamental en entornos críticos como la gestión de emergencias..
tecnologia,la tecnología haptica al simular el sentido del tacto en dispositivos electrónicos amplía las posibilidades de interacción y realismo en entornos virtuales y aumentados..
tecnologia,la tecnología de almacenamiento holográfico al registrar información tridimensional en estructuras holográficas podría revolucionar la capacidad y velocidad de almacenamiento de datos..
tecnologia,la computación neuromórfica inspirada en la estructura y función del cerebro busca desarrollar sistemas de procesamiento que imiten la eficiencia y plasticidad del tejido cerebral..
tecnologia,la tecnología de realidad táctil al permitir la simulación de texturas y resistencias en interfaces digitales avanza hacia una experiencia más inmersiva y realista en aplicaciones de entretenimiento y diseño..
tecnologia,la tecnología de reconocimiento de emociones aplicada a través de análisis facial y vocal contribuye al desarrollo de interfaces más intuitivas y personalizadas en interacciones hombre máquina..
tecnologia,la tecnología de realidad olfativa al simular olores digitales promete agregar un sentido adicional a experiencias virtuales desde el entretenimiento hasta la formación profesional..
tecnologia,la impresión de órganos en 3d utilizando células vivas representa una esperanza para superar la escasez de órganos para trasplantes y reducir la dependencia de donantes..
tecnologia,la computación de borde al procesar datos cerca de su origen minimiza la latencia y optimiza el rendimiento siendo fundamental en aplicaciones que requieren respuestas rápidas y en tiempo real..
tecnologia,la nanomedicina aplicando nanotecnología en la medicina ofrece enfoques novedosos para la detección temprana y el tratamiento específico de enfermedades a nivel molecular..
tecnologia,la tecnología de baterías de estado sólido al reemplazar los electrolitos líquidos por materiales sólidos busca mejorar la eficiencia y seguridad en el almacenamiento de energía..
tecnologia,la tecnología de telepresencia al permitir la participación remota a través de avatares digitales facilita la colaboración global y la interacción en entornos virtuales compartidos..
tecnologia,la nanorrobótica utilizando nanomáquinas para realizar tareas específicas a nivel molecular tiene aplicaciones potenciales en medicina desde la administración precisa de medicamentos hasta la eliminación de células cancerosas..
tecnologia,la computación autónoma con sistemas capaces de tomar decisiones sin intervención humana plantea cuestionamientos éticos sobre la responsabilidad y la transparencia en la toma de decisiones algorítmicas..
tecnologia,la computación federada al descentralizar el procesamiento de datos entre diferentes dispositivos promueve la privacidad al evitar la centralización de información sensible..
tecnologia,la computación evolutiva inspirada en procesos biológicos utiliza algoritmos genéticos y estrategias evolutivas para encontrar soluciones a problemas complejos y optimizar sistemas..
tecnologia,la tecnología de traducción automática potenciada por la inteligencia artificial ha avanzado significativamente en la eliminación de barreras lingüísticas facilitando la comunicación global..
tecnologia,la tecnología de fusión nuclear aspirando a replicar el proceso que alimenta al sol ofrece la promesa de una fuente de energía limpia y abundante para el futuro..
tecnologia,la tecnología de realidad gustativa al simular el sentido del gusto en entornos digitales amplía las posibilidades de experiencias multisensoriales en aplicaciones de entretenimiento y gastronomía..
tecnologia,la computación morfogenética modelando procesos biológicos de desarrollo busca desarrollar algoritmos que generen patrones complejos y estructuras en sistemas informáticos..
tecnologia,la computación quiral inspirada en la quiralidad molecular busca aprovechar propiedades cuánticas para el procesamiento de información y la resolución de problemas complejos..
tecnologia,la computación de compuestos químicos al simular y analizar interacciones moleculares acelera el diseño de nuevos materiales y medicamentos a nivel atómico..
tecnologia,la tecnología de cultivo celular en 3d al recrear entornos tridimensionales para el crecimiento celular mejora la eficacia en la producción de tejidos para aplicaciones médicas y de investigación..
tecnologia,la tecnología de reconocimiento gestual al capturar movimientos y gestos ha sido fundamental en el desarrollo de interfaces más intuitivas y en la interacción con dispositivos digitales..
tecnologia,la tecnología de impresión de alimentos utilizando ingredientes comestibles ofrece posibilidades de personalización en la creación de alimentos adaptados a necesidades dietéticas específicas..
tecnologia,la computación exascala superando la barrera de la computación a escala de exaflops busca impulsar la resolución de problemas complejos y la simulación de sistemas a una escala sin precedentes..
tecnologia,la computación neuromórfica óptica integrando conceptos de la óptica y la neurociencia busca desarrollar sistemas de procesamiento más eficientes y rápidos inspirados en el cerebro humano..
tecnologia,la computación holográfica al recrear imágenes tridimensionales mediante el uso de haces de luz proporciona una experiencia visual más inmersiva en aplicaciones como la visualización de datos..
tecnologia,la tecnología de reconocimiento de escritura a mano impulsada por algoritmos de aprendizaje automático mejora la precisión en la conversión de texto manuscrito a digital..
tecnologia,los teléfonos móviles conocidos como smartphones han evolucionado de simples dispositivos de comunicación a herramientas multifuncionales que abarcan diversos aspectos de la vida cotidiana..
tecnologia,las aplicaciones de inteligencia artificial integradas en los teléfonos modernos permiten funciones avanzadas como reconocimiento facial y asistentes virtuales mejorando la experiencia del usuario..
tecnologia,la rápida adopción de la tecnología 5g ha impulsado la velocidad de conexión en los teléfonos posibilitando una experiencia de navegación más fluida y eficiente..
tecnologia,la realidad aumentada presente en muchas aplicaciones móviles ha llevado la interactividad a un nuevo nivel permitiendo la superposición de información digital en el mundo real a través de la pantalla del teléfono..
tecnologia,la capacidad de almacenamiento de los teléfonos ha aumentado considerablemente permitiendo a los usuarios llevar consigo grandes cantidades de datos desde fotos y videos hasta documentos importantes..
tecnologia,los sistemas operativos móviles como ios y android continúan evolucionando para ofrecer interfaces intuitivas y actualizaciones que mejoran la eficiencia y la seguridad de los dispositivos..
tecnologia,la carga inalámbrica ha emergido como una tecnología conveniente eliminando la necesidad de cables y simplificando el proceso de recarga de la batería del teléfono..
tecnologia,la resistencia al agua y al polvo se ha convertido en una característica estándar en muchos teléfonos proporcionando durabilidad y protección contra elementos externos..
tecnologia,los avances en las pantallas de los teléfonos como la tecnología oled han mejorado la calidad visual ofreciendo colores más vibrantes y negros más profundos..
