category,text
tecnologia,los sensores biométricos como los escáneres de huellas dactilares y el reconocimiento facial han fortalecido la seguridad de los teléfonos protegiendo la información personal de los usuarios..
tecnologia,la expansión del almacenamiento en la nube ha facilitado la sincronización y el respaldo de datos entre dispositivos ofreciendo a los usuarios acceso a su información desde cualquier lugar..
tecnologia,las capacidades de la cámara de los teléfonos han alcanzado niveles impresionantes con múltiples lentes y funciones avanzadas que permiten a los usuarios capturar imágenes y videos de alta calidad..
tecnologia,la expansión del almacenamiento en la nube ha facilitado la sincronización y el respaldo de datos entre dispositivos ofreciendo a los usuarios acceso a su información desde cualquier lugar..
tecnologia,los avances en la duración de la batería junto con tecnologías de carga rápida han mejorado significativamente la autonomía de los teléfonos permitiendo un uso prolongado sin interrupciones..
tecnologia,la seguridad biométrica como el reconocimiento de iris agrega una capa adicional de protección a los teléfonos garantizando un acceso seguro a la información sensible..
tecnologia,las capacidades de procesamiento de los teléfonos actuales rivalizan con las de muchas computadoras personales permitiendo la ejecución de aplicaciones y juegos exigentes..
tecnologia,los teléfonos plegables representan una innovación en el diseño ofreciendo pantallas más grandes sin sacrificar la portabilidad lo que sugiere una nueva era en la forma de concebir estos dispositivos..
tecnologia,la tecnología de reconocimiento de voz ha evolucionado permitiendo a los usuarios interactuar con sus teléfonos mediante comandos de voz facilitando la realización de tareas sin necesidad de tocar la pantalla..
tecnologia,la tecnología de carga rápida inalámbrica ha eliminado las preocupaciones sobre la duración de la batería permitiendo a los usuarios recargar sus teléfonos de manera eficiente y sin cables..
tecnologia,la incorporación de tecnologías de reconocimiento de gestos en los teléfonos ha abierto nuevas posibilidades de interacción permitiendo a los usuarios controlar sus dispositivos mediante movimientos específicos..
tecnologia,la realidad extendida que incluye la realidad virtual y aumentada ha encontrado aplicaciones diversas en campos como la educación el entretenimiento y la medicina gracias a la potencia de los teléfonos modernos..
tecnologia,los teléfonos con capacidades de carga inversa han diversificado las opciones de carga permitiendo a los usuarios compartir energía con otros dispositivos como auriculares inalámbricos..
tecnologia,la inteligencia artificial aplicada a la fotografía en teléfonos ha revolucionado la captura de imágenes optimizando automáticamente configuraciones como el balance de blancos y la exposición..
tecnologia,la privacidad digital ha cobrado relevancia llevando a las empresas a desarrollar funciones que permiten a los usuarios controlar y proteger sus datos personales en los teléfonos..
tecnologia,la tecnología de reconocimiento de ubicación ha mejorado la precisión de los servicios de mapas y la navegación en tiempo real convirtiendo los teléfonos en herramientas esenciales para la movilidad urbana..
tecnologia,la evolución constante de la tecnología en las consolas de videojuegos ha permitido un aumento significativo en el rendimiento gráfico ofreciendo experiencias de juego más inmersivas y realistas..
tecnologia,la introducción de unidades de estado sólido ssd en las consolas ha revolucionado los tiempos de carga permitiendo a los jugadores acceder rápidamente a sus juegos sin largas esperas..
tecnologia,la tecnología de trazado de rayos implementada en algunas consolas de última generación ha mejorado drásticamente la calidad de la iluminación y los efectos visuales elevando el realismo de los entornos virtuales..
tecnologia,las consolas actuales han integrado capacidades de transmisión y captura de video en alta calidad facilitando que los jugadores compartan sus momentos épicos de juego en plataformas de redes sociales..
tecnologia,la retrocompatibilidad posible gracias a avances tecnológicos permite a los usuarios disfrutar de títulos de generaciones anteriores en las consolas más recientes preservando así la rica historia de los videojuegos..
tecnologia,la conectividad en la nube ha permitido servicios de juego en streaming permitiendo a los usuarios jugar títulos de alta calidad sin necesidad de descargar o instalar grandes archivos en sus consolas..
tecnologia,la tecnología de realidad virtual se está integrando en algunas consolas ofreciendo experiencias de juego envolventes que van más allá de la pantalla tradicional y sumergiendo a los jugadores en mundos virtuales tridimensionales..
tecnologia,los controladores de última generación incorporan tecnologías hápticas y gatillos adaptativos proporcionando retroalimentación táctil y una experiencia más inmersiva que responde a las acciones del jugador..
tecnologia,la inteligencia artificial aplicada al diseño de juegos ha mejorado la experiencia de juego mediante la creación de personajes no jugables más realistas y comportamientos adaptativos en entornos virtuales.
tecnologia,la capacidad de actualización del firmware de las consolas permite a los fabricantes introducir nuevas características y mejoras incluso después del lanzamiento del producto manteniendo las plataformas actualizadas y relevantes..
entretenimiento,el cine como forma de entretenimiento ha evolucionado a lo largo de los años convirtiéndose en una expresión artística que combina la narrativa visual y auditiva para sumergir al espectador en mundos imaginarios..
entretenimiento,las películas al ser una amalgama de actuación dirección cinematografía y música tienen el poder único de evocar emociones profundas y ofrecer experiencias sensoriales únicas a quienes las disfrutan..
entretenimiento,el séptimo arte también conocido como cine se ha convertido en una ventana a diversas culturas permitiendo a las audiencias explorar realidades diferentes y comprender la diversidad del mundo que nos rodea..
entretenimiento,los géneros cinematográficos desde el drama hasta la comedia ofrecen una gama diversa de opciones para que los espectadores elijan según sus preferencias personales y estados de ánimo..
entretenimiento,las películas clásicas que han resistido la prueba del tiempo continúan siendo fuente de disfrute para las generaciones actuales mostrando la atemporalidad y la perdurabilidad del buen cine..
entretenimiento,el cine independiente con su enfoque innovador y creativo desafía las convenciones narrativas y brinda una plataforma para voces emergentes y visiones únicas en la industria..
entretenimiento,la experiencia de ver una película en una sala de cine con su pantalla grande y sonido envolvente proporciona una inmersión total que va más allá de lo que se puede lograr en el hogar..
entretenimiento,los festivales de cine como cannes o sundance destacan la importancia de celebrar la diversidad cinematográfica y ofrecen un escaparate para cineastas emergentes y talento creativo..
entretenimiento,el proceso de producción cinematográfica desde el guion hasta la postproducción involucra a numerosos profesionales que trabajan en armonía para dar vida a una obra de arte visual y narrativa..
entretenimiento,el impacto cultural de ciertas películas es innegable ya que han influido en la moda la música y el lenguaje popular convirtiéndose en referentes icónicos de la sociedad..
entretenimiento,las adaptaciones cinematográficas de obras literarias a menudo generan debates sobre la fidelidad al material original y la interpretación creativa de los directores y guionistas..
entretenimiento,el cine documental al capturar la realidad de manera objetiva tiene el poder de concientizar a la audiencia sobre temas sociales políticos y medioambientales..
entretenimiento,las películas de ciencia ficción exploran conceptos futuristas y distópicos desafiando las fronteras de la imaginación y ofreciendo reflexiones sobre la tecnología y la sociedad..
entretenimiento,los efectos visuales y la tecnología cinematográfica avanzada han llevado la experiencia cinematográfica a nuevos niveles creando mundos visuales asombrosos y espectaculares..
entretenimiento,los directores visionarios como quentin tarantino o christopher nolan han dejado su marca en la industria cinematográfica con su estilo distintivo y narrativa única..
entretenimiento,la música cinematográfica con sus bandas sonoras emocionantes contribuye significativamente a la atmósfera y el impacto emocional de una película..
entretenimiento,las sagas cinematográficas como star wars o el señor de los anillos han cultivado comunidades de fans apasionados que celebran el universo expandido y la mitología creada por estas películas..
entretenimiento,el cine de animación desde clásicos de disney hasta películas contemporáneas como las de studio ghibli ha demostrado que la animación no es exclusiva del público infantil y puede abordar temas profundos y universales..
entretenimiento,los festivales de cine internacionales permiten a las audiencias descubrir películas de diversas culturas y perspectivas promoviendo el intercambio cultural y la apreciación global del cine..
entretenimiento,las películas de época transportan a los espectadores a diferentes épocas y lugares ofreciendo una visión histórica y estética única..
entretenimiento,el cine noir con su estética oscura y narrativa detectivesca ha influido en numerosos géneros y sigue siendo una fuente de inspiración para cineastas contemporáneos..
entretenimiento,las comedias románticas a pesar de seguir ciertos clichés continúan siendo populares debido a su capacidad para brindar alegría y escapismo a las audiencias..
entretenimiento,las películas de superhéroes impulsadas por el éxito de los universos cinematográficos de marvel y dc han llevado a la cultura popular la fiebre por los personajes con habilidades extraordinarias y tramas épicas..
entretenimiento,el fenómeno de las películas de culto demuestra cómo ciertos filmes han desarrollado comunidades devotas que celebran la originalidad y la singularidad de estas obras..
entretenimiento,el cine experimental al desafiar las normas convencionales busca expandir los límites de la narrativa y la percepción visual ofreciendo experiencias únicas y vanguardistas..
entretenimiento,las películas de terror con su capacidad para generar miedo y suspense exploran los miedos más profundos de la humanidad y ofrecen una liberación controlada de las emociones más intensas..
entretenimiento,las películas biográficas al contar las vidas de personas reales brindan una visión íntima de la historia y la complejidad de la condición humana..
entretenimiento,el cine de autor caracterizado por la visión distintiva del director a menudo desafía las expectativas del público y fomenta el diálogo crítico sobre la naturaleza del arte cinematográfico..
entretenimiento,las películas de guerra al abordar conflictos históricos ofrecen una reflexión profunda sobre el impacto de la violencia y la naturaleza humana en situaciones extremas..
entretenimiento,el cine social al abordar cuestiones de justicia desigualdad y derechos humanos despierta la conciencia de la audiencia y fomenta el activismo y el cambio social..
entretenimiento,el cine mudo a pesar de la ausencia de diálogo hablado lograba transmitir historias complejas a través de expresiones faciales gestos y música demostrando la fuerza visual del medio..
entretenimiento,las secuelas y remakes aunque a veces son criticados por falta de originalidad continúan siendo una parte integral de la industria cinematográfica ofreciendo nuevas interpretaciones de historias conocidas..
entretenimiento,las películas de ciencia ficción distópicas como blade runner o matrix exploran preocupaciones contemporáneas sobre la tecnología la inteligencia artificial y el futuro de la humanidad..
entretenimiento,el cine de animación stop motion con su enfoque meticuloso y artesanal ha creado obras maestras visuales que destacan por su originalidad y creatividad..
entretenimiento,las comedias satíricas al ridiculizar aspectos de la sociedad y la cultura ofrecen una crítica divertida y provocadora de la realidad..
entretenimiento,las películas basadas en hechos reales al dramatizar eventos históricos o biografías permiten a las audiencias aprender y reflexionar sobre la realidad a través del prisma del entretenimiento..
entretenimiento,las películas de fantasía al transportar a los espectadores a mundos imaginarios llenos de criaturas mágicas y paisajes impresionantes ofrecen una vía de escape a la maravilla y la aventura..
entretenimiento,las películas interactivas que permiten al espectador tomar decisiones que afectan al desarrollo de la trama representan una evolución fascinante en la forma en que experimentamos las historias cinematográficas..
entretenimiento,el cine de género que abarca desde el western hasta el cine negro ha contribuido a la diversificación de la narrativa cinematográfica y ha influenciado a generaciones de cineastas..
entretenimiento,las películas de animales ya sean documentales que exploran la vida salvaje o películas de ficción con animales como protagonistas capturan la belleza y la complejidad del reino animal..
entretenimiento,el cine de arte caracterizado por su enfoque estilizado y narrativa no convencional desafía a las audiencias a explorar nuevas formas de apreciación cinematográfica..
entretenimiento,el cine oriental con sus tradiciones narrativas y estilos visuales distintivos ha ganado reconocimiento global y ha enriquecido la diversidad cultural del cine..
entretenimiento,las películas de misterio al mantener a la audiencia en vilo fomentan la participación activa del espectador en la resolución de enigmas y revelaciones sorprendentes..
entretenimiento,las películas de ciencia ficción especulativa como ex machina o her exploran las implicaciones éticas y filosóficas de la tecnología emergente y la inteligencia artificial..
entretenimiento,el cine de aventuras al seguir héroes en viajes épicos despierta la imaginación y el sentido de la maravilla en los espectadores de todas las edades..
entretenimiento,las películas de comedia negra al abordar temas tabú con humor oscuro desafían las convenciones sociales y exploran la complejidad de la moralidad humana..
entretenimiento,las películas experimentales al desafiar las normas narrativas y visuales buscan expandir la definición misma de lo que constituye una película..
entretenimiento,el cine musical con sus números extravagantes y coreografías elaboradas crea una experiencia multisensorial que combina la música la danza y la narrativa..
entretenimiento,las películas de suspense psicológico al explorar las complejidades de la mente humana mantienen a la audiencia en vilo y fomentan la reflexión sobre la naturaleza humana..
entretenimiento,las películas de ciencia ficción de viajes en el tiempo al jugar con conceptos temporales y paradojas despiertan la curiosidad intelectual de las audiencias al explorar posibilidades fascinantes..
entretenimiento,la música como forma universal de expresión artística ha desempeñado un papel fundamental a lo largo de la historia proporcionando a las personas una vía para comunicar emociones y experiencias..
entretenimiento,los festivales de música como coachella o glastonbury se han convertido en eventos emblemáticos que reúnen a amantes de la música de todo el mundo ofreciendo experiencias inolvidables y actuaciones en vivo impactantes..
entretenimiento,la diversidad de géneros musicales desde el rock hasta el hip hop y la música clásica refleja la riqueza y la amplitud de la creatividad humana adaptándose a diferentes gustos y preferencias..
entretenimiento,la música en vivo con la energía palpable de una actuación en un escenario crea una conexión única entre los artistas y la audiencia generando momentos compartidos de euforia y comunión..
entretenimiento,la tecnología ha transformado la forma en que consumimos música permitiendo el acceso instantáneo a bibliotecas musicales vastas y diversas a través de plataformas de transmisión cambiando radicalmente la industria musical..
entretenimiento,los artistas independientes gracias a las plataformas digitales han encontrado nuevas formas de llegar a audiencias globales sin depender de las grandes discográficas democratizando el proceso creativo..
entretenimiento,la música como terapia ha demostrado tener efectos positivos en la salud mental proporcionando consuelo inspiración y una vía para expresar y procesar emociones complejas..
entretenimiento,los videoclips musicales al fusionar música y cinematografía han evolucionado de simples complementos visuales a formas de arte independientes influyendo en la moda y la cultura visual contemporánea..
entretenimiento,la música folk con su arraigo en tradiciones culturales y narrativas ha servido como un medio para preservar y transmitir historias a lo largo de generaciones creando puentes entre el pasado y el presente..
entretenimiento,los conciertos acústicos al resaltar la pureza de la música sin artificios ofrecen una experiencia íntima que permite a los artistas conectarse directamente con su audiencia..
entretenimiento,la música electrónica con su capacidad para experimentar con sonidos y ritmos ha generado géneros innovadores y ha influido en la evolución de la música popular de maneras inesperadas..
entretenimiento,los compositores clásicos como beethoven o mozart han dejado un legado perdurable demostrando que la música trasciende las barreras del tiempo y sigue siendo apreciada por su genialidad artística..
entretenimiento,las colaboraciones entre artistas de diferentes géneros al fusionar estilos y perspectivas han dado lugar a éxitos sorprendentes que desafían las expectativas de la audiencia..
entretenimiento,la música latina con su diversidad de ritmos y géneros ha experimentado un auge global influyendo en la escena musical internacional y llevando la cultura latinoamericana a nuevos horizontes..
entretenimiento,la música como forma de protesta social ha sido un catalizador para el cambio dando voz a movimientos y generando conciencia sobre cuestiones políticas y sociales..
entretenimiento,la música jazz con su énfasis en la improvisación y la expresión individual ha influido en una variedad de géneros y ha sido un terreno fértil para la creatividad musical..
entretenimiento,los álbumes conceptuales al contar historias cohesivas a lo largo de varias canciones ofrecen una experiencia auditiva más profunda y una apreciación completa del arte del álbum..
entretenimiento,la música indie al priorizar la autenticidad y la originalidad ha contribuido a la diversificación del panorama musical al brindar oportunidades a artistas fuera del mainstream..
entretenimiento,la música tradicional transmitida de generación en generación preserva la identidad cultural y sirve como un recordatorio de las raíces y la historia de una comunidad..
entretenimiento,los músicos que cruzan fronteras lingüísticas como shakira o bts han demostrado que la música es un lenguaje universal que puede trascender barreras culturales y conectar a personas de todo el mundo..
entretenimiento,la música en el cine con sus bandas sonoras evocadoras potencia las emociones de las películas y se ha convertido en una parte integral de la experiencia cinematográfica..
entretenimiento,los conciertos benéficos como live aid han demostrado el poder unificador de la música al movilizar recursos para causas humanitarias y concienciar sobre problemas globales..
entretenimiento,la música experimental al desafiar las convenciones musicales permite a los artistas explorar nuevos sonidos y técnicas expandiendo los límites de la creatividad musical..
entretenimiento,la música country arraigada en la tradición rural y las historias cotidianas ha evolucionado para abordar temas contemporáneos y atraer a audiencias diversas..
entretenimiento,la música ambiental con sus paisajes sonoros envolventes ofrece una experiencia tranquila y meditativa siendo utilizada en entornos terapéuticos y espacios públicos..
entretenimiento,youtube como la plataforma de videos más grande del mundo ha transformado la forma en que consumimos contenido de entretenimiento ofreciendo una diversidad de videos que van desde tutoriales hasta producciones cinematográficas independientes..
entretenimiento,las plataformas de streaming como netflix y hulu han revolucionado la forma en que accedemos a programas de televisión y películas permitiéndonos disfrutar de contenido a demanda desde la comodidad de nuestros hogares..
entretenimiento,la monetización en youtube ha brindado a creadores de contenido la oportunidad de convertir su pasión por el entretenimiento en una carrera sostenible generando ingresos a través de anuncios y membresías de suscriptores..
entretenimiento,la diversificación de contenido en youtube abarca desde vlogs diarios hasta series documentales proporcionando opciones para todos los gustos e intereses creando una experiencia personalizada para cada usuario..
entretenimiento,los creadores de contenido en youtube con sus personalidades únicas y autenticidad han establecido conexiones profundas con sus audiencias generando comunidades en línea comprometidas y leales..
entretenimiento,la música en youtube y otras plataformas de streaming ha democratizado la industria musical ofreciendo a artistas independientes la oportunidad de llegar a audiencias globales sin depender de sellos discográficos tradicionales..
entretenimiento,las transmisiones en vivo en plataformas como twitch han llevado la interacción entre creadores y audiencias a un nuevo nivel permitiendo a los espectadores participar activamente en tiempo real a través de comentarios y donaciones..
entretenimiento,las colaboraciones entre creadores de contenido en youtube han generado proyectos innovadores y entretenidos combinando diferentes estilos y perspectivas para crear contenido único y atractivo..
entretenimiento,youtube originals con sus producciones exclusivas ha atraído a creadores de renombre y ha elevado la calidad de la programación original en la plataforma compitiendo con producciones de televisión convencionales..
entretenimiento,youtube originals con sus producciones exclusivas ha atraído a creadores de renombre y ha elevado la calidad de la programación original en la plataforma compitiendo con producciones de televisión convencionales..
entretenimiento,los algoritmos de recomendación en youtube y otras plataformas de streaming utilizan inteligencia artificial para personalizar las sugerencias de contenido adaptándose a los gustos individuales de cada usuario..
entretenimiento,los tutoriales y contenido educativo en youtube han democratizado el acceso al conocimiento brindando a millones de personas la oportunidad de aprender nuevas habilidades y obtener información valiosa de manera gratuita..
entretenimiento,los algoritmos de recomendación en youtube y otras plataformas de streaming utilizan inteligencia artificial para personalizar las sugerencias de contenido adaptándose a los gustos individuales de cada usuario..
entretenimiento,las películas y programas de televisión independientes han encontrado en plataformas de streaming un medio para llegar a audiencias globales superando las barreras tradicionales de distribución..
entretenimiento,la transmisión en vivo en youtube ha permitido la cobertura en tiempo real de eventos importantes desde conciertos hasta noticias de última hora brindando a los espectadores una experiencia inmersiva y actualizada..
entretenimiento,youtube shorts y funciones similares en otras plataformas han capitalizado la popularidad de videos cortos ofreciendo a creadores una forma rápida y efectiva de compartir contenido atractivo..
entretenimiento,las estrategias de marketing de influencers en youtube y otras plataformas de streaming han cambiado la dinámica de la publicidad permitiendo a marcas llegar a audiencias específicas a través de colaboraciones auténticas con creadores de contenido..
entretenimiento,la realidad virtual y la transmisión en 360 grados en youtube han proporcionado una experiencia inmersiva única permitiendo a los espectadores explorar entornos virtuales y eventos en tiempo real..
entretenimiento,la creación de comunidades en torno a temas específicos en youtube conocidas como nichos ha permitido a los usuarios encontrar contenido altamente especializado que se adapte a sus intereses particulares..
entretenimiento,la accesibilidad en youtube con funciones como subtítulos automáticos y traducciones ha ampliado el alcance del contenido haciendo que sea más inclusivo para audiencias de diferentes regiones y habilidades lingüísticas..
entretenimiento,las plataformas de streaming de música como spotify y apple music han cambiado la forma en que consumimos canciones permitiéndonos crear listas de reproducción personalizadas y descubrir nueva música de manera fácil..
entretenimiento,los canales de estudio en youtube han permitido a cineastas y creadores de contenido independientes producir y distribuir contenido de calidad sin los recursos masivos de la industria cinematográfica tradicional..
